{
  "schema_version": "1.0.0",
  "context": {
    "workspace_id": "ws-demo",
    "session_id": "session-demo",
    "run_id": "run-demo",
    "document_id": "fs-demo",
    "base_document_version": "dv-7",
    "context_snapshot_id": "ctx-7",
    "template_id": "traditional-abap-five",
    "template_version": "1.0.0"
  },
  "change_set_id": "tmp:change-1",
  "reason": "用户要求研究容差方案",
  "operations": [
    {
      "op": "replace",
      "entity_type": "rule",
      "target_id": "rule-1",
      "expected_revision": 1,
      "before_hash": "fixture-hash-rule-1",
      "value": {
        "id": "rule-1",
        "revision": 2,
        "text": "建议增加容差分支；金额与差额处理尚待确认。",
        "classification": "recommendation",
        "source_refs": [
          {
            "evidence_id": "ev-message-1",
            "locator": "message:msg-1#chars=0-20",
            "conclusion": "用户要求供应商未清项批量处理"
          }
        ],
        "depends_on": []
      },
      "reason": "用户新意图"
    }
  ],
  "impacts": [
    {
      "entity_id": "rule-1",
      "reason": "核心规则改变",
      "action": "invalidate_confirmation"
    },
    {
      "entity_id": "test-1",
      "reason": "需补充容差边界用例",
      "action": "revise"
    }
  ],
  "atomic_groups": [
    {
      "id": "group-1",
      "operation_target_ids": [
        "rule-1"
      ],
      "reason": "规则修订必须连同失效标记提交"
    }
  ],
  "new_issue_ids": []
}
